{
  "$schema": "http://json-schema.org/draft-07/schema#",
  "$id": "https://icetrack.dev/schema/celebrity.schema.json",
  "title": "IceTrack Celebrity",
  "description": "A public figure tracked by IceTrack. Public career facts only — no private personal data.",
  "type": "object",
  "required": [
    "id",
    "name",
    "category"
  ],
  "additionalProperties": false,
  "properties": {
    "id": {
      "type": "string",
      "pattern": "^[a-z0-9]+(-[a-z0-9]+)*$"
    },
    "name": {
      "type": "string",
      "minLength": 2,
      "maxLength": 120
    },
    "realName": {
      "type": "string",
      "maxLength": 160
    },
    "category": {
      "type": "string",
      "enum": [
        "music",
        "sports",
        "film",
        "business",
        "crypto",
        "fashion",
        "media",
        "royalty",
        "art"
      ]
    },
    "nationality": {
      "type": "string",
      "maxLength": 80
    },
    "bornYear": {
      "type": "integer",
      "minimum": 1900,
      "maximum": 2100
    },
    "bio": {
      "type": "string",
      "maxLength": 600
    },
    "imageUrl": {
      "type": "string"
    },
    "wikipedia": {
      "type": "string",
      "minLength": 4
    },
    "updatedAt": {
      "type": "string",
      "format": "date"
    },
    "imageCredit": {
      "type": "object",
      "description": "Attribution for the image. Required by CC BY-SA and similar licences.",
      "additionalProperties": false,
      "required": [
        "url"
      ],
      "properties": {
        "url": {
          "type": "string"
        },
        "author": {
          "type": "string",
          "maxLength": 200
        },
        "license": {
          "type": "string",
          "maxLength": 120
        },
        "sourcePage": {
          "type": "string"
        }
      }
    }
  }
}
