{
  "id": "kim-kardashian",
  "name": "Kim Kardashian",
  "realName": "Kimberly Noel Kardashian",
  "category": "business",
  "nationality": "United States",
  "bornYear": 1980,
  "bio": "Media personality and founder of SKIMS. A defining figure of modern celebrity business.",
  "wikipedia": "https://en.wikipedia.org/wiki/Kim_Kardashian",
  "updatedAt": "2026-09-01"
}
