{
  "id": "jay-z",
  "name": "Jay-Z",
  "realName": "Shawn Corey Carter",
  "category": "music",
  "nationality": "United States",
  "bornYear": 1969,
  "bio": "Rapper and entrepreneur, founder of Roc Nation and one of the wealthiest musicians in the world.",
  "wikipedia": "https://en.wikipedia.org/wiki/Jay-Z",
  "updatedAt": "2026-09-01"
}
